<?xml version="1.0" encoding="UTF-8"?>
<!DOCTYPE piratas SYSTEM "piratas.dtd">
<piratas>
    <pirata>
        <nombre>Jack Sparrow</nombre>
        <imagen>https://sparrow.jpg</imagen>
        <datos_actor>
            <nombre>Johnny</nombre>
            <apellidos>Deep</apellidos>
            <sexo>M</sexo>
            <nacimiento>09-06-1963</nacimiento>
        </datos_actor>
        <peliculas>
            <pelicula>
                <datos>
                    <titulo>La maldición de la perla negra</titulo>
                    <saga>Piratas del Caribe</saga>
                </datos>
            </pelicula>
        </peliculas>
        <roles>
            <rol>
                <tipo_rol>CAPITÁN</tipo_rol>
                <barco>La Perla Negra</barco>
            </rol>
        </roles>
    </pirata>
</piratas>